Condiment,Price,DescriptionWhole Milk,800,Milk from which no constituent (such as fat) has been removed. milkSkim Milk,1000,Milk from which the cream has been removedSoy Milk,1200,Liquid made by grinding and boiling soybeans with waterCream,1000,Dairy product composed of the higher-butterfat layer skimmed from the top of milk before homogenizationIce Cream,1500, sweetened frozen food typically eaten as a snack or dessertChocolate,1500,"Typically sweet, usually brown, food preparation of Theobroma cacao seeds"